{
  "connector_version": 0,
  "id": "local-files",
  "name": "Local files",
  "vendor": "Ogun",
  "category": "source",
  "regions": [
    "global",
    "cn"
  ],
  "summary": "Deliver a workflow's results as files in a folder on this computer. Each file is written under a path built from a closed template and never outside the folder.",
  "docs_url": "https://github.com/ArefinAlter/ogun/blob/main/docs/adr/0016-parse-and-export-operators.md",
  "maturity": "built",
  "directions": [
    "sink"
  ],
  "protocol": "file",
  "auth": [],
  "settings": [
    {
      "name": "directory",
      "label": "Folder",
      "type": "string",
      "required": true,
      "help": "An existing folder on this computer. Exports are written inside it, never outside."
    }
  ],
  "egress": {
    "domains": [],
    "ports": [],
    "note": "Writes to a folder on this machine and reaches nothing outside it."
  },
  "operators": [],
  "implementation": {
    "path": "crates/ogun-ops/src/export",
    "evidence": "unit tests and a run through the Windows app on 2026-10-26 (docs/ACCEPTANCE-0.0.1b.md)"
  },
  "notes": "Needs a connection of this connector and `policy.approval: always` on the export node (ADR 0016)."
}
